{
  "$schema": "https://json-schema.org/draft/2020-12/schema",
  "title": "AuditedRoutes",
  "type": "array",
  "items": {
    "type": "object",
    "required": ["route_id", "score", "audit_verdict", "critical_issues", "steps"],
    "properties": {
      "route_id": {"type": "integer"},
      "score": {"type": "number"},
      "audit_verdict": {"type": "string"},
      "critical_issues": {"type": "array", "items": {"type": "string"}},
      "precursors": {"type": "array", "items": {"type": "string"}},
      "steps": {
        "type": "array",
        "items": {
          "type": "object",
          "properties": {
            "reaction_class": {"type": "string"},
            "reagents": {"type": "array", "items": {"type": "string"}},
            "conditions": {"type": "string"},
            "reaction_smiles": {"type": "string"},
            "rxn_smiles": {"type": "string"},
            "smirks": {"type": "string"}
          },
          "additionalProperties": true
        }
      }
    },
    "additionalProperties": true
  }
}
